{
  "$schema": "https://json-schema.org/draft/2020-12/schema",
  "$id": "urn:intdata:schema:release-manifest:v1",
  "title": "ReleaseManifestV1",
  "type": "object",
  "additionalProperties": false,
  "required": [
    "schema_version",
    "release_id",
    "producer_id",
    "module_id",
    "installation_lock_digest",
    "source_commit",
    "version",
    "created_at",
    "source",
    "artifacts",
    "sbom",
    "scan_attestation",
    "modules",
    "compatibility",
    "rollback_predecessor",
    "trust_bundle",
    "signature_policy"
  ],
  "properties": {
    "schema_version": { "const": "ReleaseManifestV1" },
    "release_id": { "$ref": "#/$defs/identifier" },
    "producer_id": { "$ref": "#/$defs/identifier" },
    "module_id": { "$ref": "#/$defs/identifier" },
    "installation_lock_digest": { "$ref": "#/$defs/sha256" },
    "source_commit": { "type": "string", "pattern": "^(?:[a-f0-9]{40}|[a-f0-9]{64})$" },
    "version": { "$ref": "#/$defs/version" },
    "created_at": { "$ref": "#/$defs/timestamp" },
    "source": { "$ref": "#/$defs/source" },
    "artifacts": {
      "type": "array",
      "minItems": 1,
      "maxItems": 4096,
      "items": { "$ref": "#/$defs/artifact" }
    },
    "sbom": { "$ref": "#/$defs/evidence" },
    "scan_attestation": { "$ref": "#/$defs/evidence" },
    "modules": {
      "type": "array",
      "minItems": 1,
      "maxItems": 1,
      "items": { "$ref": "#/$defs/module_ref" }
    },
    "compatibility": {
      "type": "object",
      "additionalProperties": false,
      "required": ["platform_api", "operating_systems", "architectures"],
      "properties": {
        "platform_api": { "const": "v1" },
        "operating_systems": {
          "type": "array",
          "minItems": 1,
          "maxItems": 8,
          "uniqueItems": true,
          "items": { "enum": ["linux", "windows"] }
        },
        "architectures": {
          "type": "array",
          "minItems": 1,
          "maxItems": 8,
          "uniqueItems": true,
          "items": { "enum": ["amd64", "arm64"] }
        }
      }
    },
    "rollback_predecessor": {
      "oneOf": [
        { "$ref": "#/$defs/release_ref" },
        { "type": "null" }
      ]
    },
    "trust_bundle": { "$ref": "#/$defs/evidence" },
    "signature_policy": {
      "type": "object",
      "additionalProperties": false,
      "required": ["role", "payload_type", "algorithm"],
      "properties": {
        "role": { "const": "intdata.release-manifest.v1" },
        "payload_type": { "const": "application/vnd.intdata.release-manifest.v1+json" },
        "algorithm": { "const": "Ed25519" }
      }
    }
  },
  "$defs": {
    "identifier": {
      "type": "string",
      "minLength": 1,
      "maxLength": 128,
      "pattern": "^[a-z][a-z0-9]*(?:[._:-][a-z0-9]+)*$"
    },
    "version": { "type": "string", "minLength": 1, "maxLength": 64, "pattern": "^[0-9A-Za-z][0-9A-Za-z._+-]*$" },
    "sha256": { "type": "string", "pattern": "^[a-f0-9]{64}$" },
    "decimal_size": { "type": "string", "pattern": "^(?:0|[1-9][0-9]{0,20})$" },
    "timestamp": {
      "type": "string",
      "format": "date-time",
      "pattern": "^\\d{4}-\\d{2}-\\d{2}T\\d{2}:\\d{2}:\\d{2}Z$"
    },
    "source": {
      "type": "object",
      "additionalProperties": false,
      "required": ["repository", "commit", "tree_sha256", "remote_ref"],
      "properties": {
        "repository": { "type": "string", "format": "uri", "pattern": "^https://" },
        "commit": { "type": "string", "pattern": "^(?:[a-f0-9]{40}|[a-f0-9]{64})$" },
        "tree_sha256": { "$ref": "#/$defs/sha256" },
        "remote_ref": { "type": "string", "minLength": 1, "maxLength": 255 }
      }
    },
    "artifact": {
      "type": "object",
      "additionalProperties": false,
      "required": ["name", "media_type", "sha256", "size_bytes"],
      "properties": {
        "name": { "type": "string", "minLength": 1, "maxLength": 255, "pattern": "^(?!/)(?!.*\\.\\.)[^\\\\]+$" },
        "media_type": { "type": "string", "pattern": "^[a-z0-9.+-]+/[a-z0-9.+-]+$", "maxLength": 128 },
        "sha256": { "$ref": "#/$defs/sha256" },
        "size_bytes": { "$ref": "#/$defs/decimal_size" }
      }
    },
    "evidence": {
      "type": "object",
      "additionalProperties": false,
      "required": ["sha256", "size_bytes"],
      "properties": {
        "sha256": { "$ref": "#/$defs/sha256" },
        "size_bytes": { "$ref": "#/$defs/decimal_size" }
      }
    },
    "module_ref": {
      "type": "object",
      "additionalProperties": false,
      "required": ["module_id", "version", "manifest_sha256"],
      "properties": {
        "module_id": { "$ref": "#/$defs/identifier" },
        "version": { "$ref": "#/$defs/version" },
        "manifest_sha256": { "$ref": "#/$defs/sha256" }
      }
    },
    "release_ref": {
      "type": "object",
      "additionalProperties": false,
      "required": ["release_id", "version", "manifest_sha256"],
      "properties": {
        "release_id": { "$ref": "#/$defs/identifier" },
        "version": { "$ref": "#/$defs/version" },
        "manifest_sha256": { "$ref": "#/$defs/sha256" }
      }
    }
  }
}
